{
  "model": "claude-sonnet-5",
  "contextWindow": 200000,
  "maxOutputTokens": 64000,
  "acceptsImages": true,
  "effort": [
    "low",
    "medium",
    "high",
    "xhigh",
    "max"
  ],
  "usageFields": {
    "input": "input_tokens",
    "output": "output_tokens",
    "cacheRead": "cache_read_input_tokens",
    "cacheWrite": "cache_creation_input_tokens"
  },
  "quirks": {
    "cacheMarker": "cache_control breakpoints in the request"
  }
}
